InvoiceNo,StockCode,Description,Quantity,InvoiceDate,UnitPrice,CustomerID,Country,Month,Total cost
C547376,21535,RED RETROSPOT SMALL MILK JUG,-1,3/22/2011 14:40,2.55,14227,United Kingdom,3,-2.55
C547388,84050,PINK HEART SHAPE EGG FRYING PAN,-12,3/22/2011 16:07,1.65,12352,Norway,3,-19.8
C547388,37448,CERAMIC CAKE DESIGN SPOTTED MUG,-12,3/22/2011 16:07,1.49,12352,Norway,3,-17.88
C547388,22784,LANTERN CREAM GAZEBO ,-3,3/22/2011 16:07,4.95,12352,Norway,3,-14.85
C547388,22701,PINK DOG BOWL,-6,3/22/2011 16:07,2.95,12352,Norway,3,-17.7
C547388,22645,CERAMIC HEART FAIRY CAKE MONEY BANK,-12,3/22/2011 16:07,1.45,12352,Norway,3,-17.4
C547388,22413,METAL SIGN TAKE IT OR LEAVE IT ,-6,3/22/2011 16:07,2.95,12352,Norway,3,-17.7
C547388,21914,BLUE HARMONICA IN BOX ,-12,3/22/2011 16:07,1.25,12352,Norway,3,-15
C547408,22627,MINT KITCHEN SCALES,-1,3/23/2011 8:55,8.5,15658,United Kingdom,3,-8.5
C547408,22423,REGENCY CAKESTAND 3 TIER,-1,3/23/2011 8:55,12.75,15658,United Kingdom,3,-12.75
C547409,23176,ABC TREASURE BOOK BOX ,-8,3/23/2011 8:59,2.25,13092,United Kingdom,3,-18
C547410,21937,STRAWBERRY   PICNIC BAG,-1,3/23/2011 9:02,2.95,18183,United Kingdom,3,-2.95
C547495,22384,LUNCH BAG PINK POLKADOT,-2,3/23/2011 12:11,1.65,15021,United Kingdom,3,-3.3
C547502,84755,COLOUR GLASS T-LIGHT HOLDER HANGING,-1,3/23/2011 12:42,0.65,14513,United Kingdom,3,-0.65
C547502,71477,COLOUR GLASS. STAR T-LIGHT HOLDER,-1,3/23/2011 12:42,3.25,14513,United Kingdom,3,-3.25
C547502,22837,HOT WATER BOTTLE BABUSHKA ,-1,3/23/2011 12:42,4.65,14513,United Kingdom,3,-4.65
C547502,22189,CREAM HEART CARD HOLDER,-1,3/23/2011 12:42,3.95,14513,United Kingdom,3,-3.95
C547502,22175,PINK OWL SOFT TOY,-1,3/23/2011 12:42,2.95,14513,United Kingdom,3,-2.95
C547502,22077,6 RIBBONS RUSTIC CHARM,-1,3/23/2011 12:42,1.65,14513,United Kingdom,3,-1.65
C547574,22841,ROUND CAKE TIN VINTAGE GREEN,-2,3/24/2011 10:13,7.95,14223,United Kingdom,3,-15.9
C547581,22367,CHILDRENS APRON SPACEBOY DESIGN,-1,3/24/2011 10:58,1.95,12474,Germany,3,-1.95
C547581,22554,PLASTERS IN TIN WOODLAND ANIMALS,-1,3/24/2011 10:58,1.65,12474,Germany,3,-1.65
C547581,21561,DINOSAUR LUNCH BOX WITH CUTLERY,-1,3/24/2011 10:58,2.55,12474,Germany,3,-2.55
C547581,22236,CAKE STAND 3 TIER MAGIC GARDEN,-1,3/24/2011 10:58,12.75,12474,Germany,3,-12.75
C547582,23194,GYMKHANA TREASURE BOOK BOX,-3,3/24/2011 11:06,2.25,12474,Germany,3,-6.75
C547582,23177,TREASURE ISLAND BOOK BOX,-2,3/24/2011 11:06,2.25,12474,Germany,3,-4.5
C547594,22978,PANTRY ROLLING PIN,-4,3/24/2011 11:19,3.75,12693,Germany,3,-15
C547661,22356,CHARLOTTE BAG PINK POLKADOT,-2,3/24/2011 13:09,0.85,13736,United Kingdom,3,-1.7
C547661,21874,GIN AND TONIC MUG,-1,3/24/2011 13:09,1.25,13736,United Kingdom,3,-1.25
C547661,21216,"SET 3 RETROSPOT TEA,COFFEE,SUGAR",-1,3/24/2011 13:09,4.95,13736,United Kingdom,3,-4.95
C547675,22263,FELT EGG COSY LADYBIRD ,-49,3/24/2011 14:07,0.66,17754,United Kingdom,3,-32.34
C547676,22423,REGENCY CAKESTAND 3 TIER,-2,3/24/2011 14:15,10.95,15189,United Kingdom,3,-21.9
C547710,21626,VINTAGE UNION JACK PENNANT,-2,3/24/2011 19:27,1.95,14875,United Kingdom,3,-3.9
C547711,22692,DOORMAT WELCOME TO OUR HOME,-1,3/24/2011 19:31,7.95,13534,United Kingdom,3,-7.95
C547763,22963,JAM JAR WITH GREEN LID,-12,3/25/2011 11:31,0.85,14194,United Kingdom,3,-10.2
C547763,22666,RECIPE BOX PANTRY YELLOW DESIGN,-3,3/25/2011 11:31,2.95,14194,United Kingdom,3,-8.85
C547763,85150,LADIES & GENTLEMEN METAL SIGN,-1,3/25/2011 11:31,2.55,14194,United Kingdom,3,-2.55
C547763,23182,TOILET SIGN OCCUPIED OR VACANT,-1,3/25/2011 11:31,0.83,14194,United Kingdom,3,-0.83
C547763,21259,VICTORIAN SEWING BOX SMALL ,-1,3/25/2011 11:31,5.95,14194,United Kingdom,3,-5.95
C547791,22634,CHILDS BREAKFAST SET SPACEBOY ,-2,3/25/2011 12:07,9.95,17979,United Kingdom,3,-19.9
C547797,37449,CERAMIC CAKE STAND + HANGING CAKES,-1,3/25/2011 12:34,9.95,17460,United Kingdom,3,-9.95
C547798,22333,RETROSPOT PARTY BAG + STICKER SET,-2,3/25/2011 12:43,1.65,17204,United Kingdom,3,-3.3
C547798,22967,SET 3 SONG BIRD PAPER EGGS ASSORTED,-12,3/25/2011 12:43,2.95,17204,United Kingdom,3,-35.4
C547798,22957,SET 3 PAPER VINTAGE CHICK PAPER EGG,-12,3/25/2011 12:43,2.95,17204,United Kingdom,3,-35.4
C547802,71459,HANGING JAM JAR T-LIGHT HOLDER,-5,3/25/2011 13:12,0.72,12921,United Kingdom,3,-3.6
C547806,22720,SET OF 3 CAKE TINS PANTRY DESIGN ,-1,3/25/2011 13:37,4.95,12528,Germany,3,-4.95
C547806,21232,STRAWBERRY CERAMIC TRINKET BOX,-1,3/25/2011 13:37,1.25,12528,Germany,3,-1.25
C547807,22962,JAM JAR WITH PINK LID,-2,3/25/2011 13:41,0.85,14194,United Kingdom,3,-1.7
C547807,85194S,HANGING SPRING FLOWER EGG SMALL,-4,3/25/2011 13:41,0.65,14194,United Kingdom,3,-2.6
C547808,37450,CERAMIC CAKE BOWL + HANGING CAKES,-4,3/25/2011 13:42,2.95,13014,United Kingdom,3,-11.8
C547808,21257,VICTORIAN SEWING BOX MEDIUM,-1,3/25/2011 13:42,7.95,13014,United Kingdom,3,-7.95
C547836,22423,REGENCY CAKESTAND 3 TIER,-9,3/27/2011 10:19,10.95,15465,United Kingdom,3,-98.55
C547838,84949,SILVER HANGING T-LIGHT HOLDER,-6,3/27/2011 10:47,1.65,12916,United Kingdom,3,-9.9
C547838,82483,WOOD 2 DRAWER CABINET WHITE FINISH,-2,3/27/2011 10:47,6.95,12916,United Kingdom,3,-13.9
C547847,20726,LUNCH BAG WOODLAND,-1,3/27/2011 12:04,1.65,14232,United Kingdom,3,-1.65
C547848,85099B,JUMBO BAG RED RETROSPOT,-1,3/27/2011 12:05,1.95,12921,United Kingdom,3,-1.95
C547849,21232,STRAWBERRY CERAMIC TRINKET BOX,-3,3/27/2011 12:06,1.25,12471,Germany,3,-3.75
C547851,21558,SKULL LUNCH BOX WITH CUTLERY ,-1,3/27/2011 12:08,2.55,16782,United Kingdom,3,-2.55
C547851,20727,LUNCH BAG  BLACK SKULL.,-1,3/27/2011 12:08,1.65,16782,United Kingdom,3,-1.65
C547852,22045,SPACEBOY GIFT WRAP,-25,3/27/2011 12:11,0.42,15065,United Kingdom,3,-10.5
C547853,21041,RED RETROSPOT OVEN GLOVE DOUBLE,-1,3/27/2011 12:11,2.95,15615,United Kingdom,3,-2.95
C547853,21929,JUMBO BAG PINK VINTAGE PAISLEY,-3,3/27/2011 12:11,1.95,15615,United Kingdom,3,-5.85
C547853,20727,LUNCH BAG  BLACK SKULL.,-3,3/27/2011 12:11,1.65,15615,United Kingdom,3,-4.95
C547854,22951,60 CAKE CASES DOLLY GIRL DESIGN,-24,3/27/2011 12:12,0.55,14586,United Kingdom,3,-13.2
C547854,22530,MAGIC DRAWING SLATE DOLLY GIRL ,-24,3/27/2011 12:12,0.42,14586,United Kingdom,3,-10.08
C547855,22843,BISCUIT TIN VINTAGE GREEN,-1,3/27/2011 12:13,6.75,14194,United Kingdom,3,-6.75
C547856,47566,PARTY BUNTING,-4,3/27/2011 12:14,4.95,16256,United Kingdom,3,-19.8
C547857,85062,PEARL CRYSTAL PUMPKIN T-LIGHT HLDR,-3,3/27/2011 12:14,1.65,13050,United Kingdom,3,-4.95
C547857,82483,WOOD 2 DRAWER CABINET WHITE FINISH,-2,3/27/2011 12:14,6.95,13050,United Kingdom,3,-13.9
C547858,22797,CHEST OF DRAWERS GINGHAM HEART ,-1,3/27/2011 12:16,16.95,14911,EIRE,3,-16.95
C547858,23178,JAM CLOCK MAGNET,-1,3/27/2011 12:16,2.89,14911,EIRE,3,-2.89
C547858,22720,SET OF 3 CAKE TINS PANTRY DESIGN ,-1,3/27/2011 12:16,4.95,14911,EIRE,3,-4.95
C547859,85027L,FRENCH CHATEAU LARGE PLATTER ,-5,3/27/2011 12:16,1.95,13725,United Kingdom,3,-9.75
C547889,85040B,SET/4 BLUE FLOWER CANDLES IN BOWL,-1,3/28/2011 10:02,1.65,14410,United Kingdom,3,-1.65
C547889,22834,HAND WARMER BABUSHKA DESIGN,-1,3/28/2011 10:02,2.1,14410,United Kingdom,3,-2.1
C547889,22866,HAND WARMER SCOTTY DOG DESIGN,-1,3/28/2011 10:02,2.1,14410,United Kingdom,3,-2.1
C547889,20934,SET/3 POT PLANT CANDLES,-1,3/28/2011 10:02,5.45,14410,United Kingdom,3,-5.45
C547889,22442,GROW YOUR OWN FLOWERS SET OF 3,-1,3/28/2011 10:02,7.95,14410,United Kingdom,3,-7.95
C547889,21124,SET/10 BLUE POLKADOT PARTY CANDLES,-1,3/28/2011 10:02,1.25,14410,United Kingdom,3,-1.25
C547889,21122,SET/10 PINK POLKADOT PARTY CANDLES,-1,3/28/2011 10:02,1.25,14410,United Kingdom,3,-1.25
C547889,22072,RED RETROSPOT TEA CUP AND SAUCER ,-2,3/28/2011 10:02,3.75,14410,United Kingdom,3,-7.5
C547889,21539,RED RETROSPOT BUTTER DISH,-2,3/28/2011 10:02,4.95,14410,United Kingdom,3,-9.9
C547958,20713,JUMBO BAG OWLS,-100,3/28/2011 15:18,1.65,15032,United Kingdom,3,-165
C547961,22411,JUMBO SHOPPER VINTAGE RED PAISLEY,-100,3/28/2011 15:30,1.65,15032,United Kingdom,3,-165
C547961,21929,JUMBO BAG PINK VINTAGE PAISLEY,-100,3/28/2011 15:30,1.65,15032,United Kingdom,3,-165
C547968,22859,EASTER TIN BUNNY BOUQUET,-1,3/28/2011 16:02,1.65,12471,Germany,3,-1.65
C547968,84228,HEN HOUSE W CHICK STANDING,-1,3/28/2011 16:02,0.42,12471,Germany,3,-0.42
C547988,22467,GUMBALL COAT RACK,-2,3/29/2011 9:19,2.55,13477,United Kingdom,3,-5.1
C547992,22180,RETROSPOT LAMP,-1,3/29/2011 9:58,9.95,18225,United Kingdom,3,-9.95
C547992,22891,TEA FOR ONE POLKADOT,-3,3/29/2011 9:58,4.25,18225,United Kingdom,3,-12.75
C548009,22720,SET OF 3 CAKE TINS PANTRY DESIGN ,-2,3/29/2011 10:55,4.95,14245,United Kingdom,3,-9.9
C548015,82583,HOT BATHS METAL SIGN,-30,3/29/2011 11:30,1.69,13802,United Kingdom,3,-50.7
C548155,22781,GUMBALL MAGAZINE RACK,-6,3/29/2011 13:18,7.65,15906,United Kingdom,3,-45.9
C548174,22725,ALARM CLOCK BAKELIKE CHOCOLATE,-1,3/29/2011 14:17,3.75,13662,United Kingdom,3,-3.75
C548187,22423,REGENCY CAKESTAND 3 TIER,-1,3/29/2011 15:06,12.75,17511,United Kingdom,3,-12.75
C548187,47590B,PINK HAPPY BIRTHDAY BUNTING,-1,3/29/2011 15:06,5.45,17511,United Kingdom,3,-5.45
C548187,21232,STRAWBERRY CERAMIC TRINKET BOX,-1,3/29/2011 15:06,1.25,17511,United Kingdom,3,-1.25
C548193,22383,LUNCH BAG SUKI DESIGN ,-1,3/29/2011 15:27,1.65,14680,United Kingdom,3,-1.65
C548193,20728,LUNCH BAG CARS BLUE,-1,3/29/2011 15:27,1.65,14680,United Kingdom,3,-1.65
C548193,20726,LUNCH BAG WOODLAND,-2,3/29/2011 15:27,1.65,14680,United Kingdom,3,-3.3
C548193,20725,LUNCH BAG RED RETROSPOT,-3,3/29/2011 15:27,1.45,14680,United Kingdom,3,-4.35
C548193,84997A,CHILDRENS CUTLERY POLKADOT GREEN ,-1,3/29/2011 15:27,3.75,14680,United Kingdom,3,-3.75
C548193,21731,RED TOADSTOOL LED NIGHT LIGHT,-2,3/29/2011 15:27,1.65,14680,United Kingdom,3,-3.3
C548193,22628,PICNIC BOXES SET OF 3 RETROSPOT ,-1,3/29/2011 15:27,4.95,14680,United Kingdom,3,-4.95
C548307,21714,CITRONELLA CANDLE GARDEN POT,-6,3/30/2011 11:59,1.25,17314,United Kingdom,3,-7.5
C548341,21621,VINTAGE UNION JACK BUNTING,-4,3/30/2011 14:30,8.5,13089,United Kingdom,3,-34
C548350,21621,VINTAGE UNION JACK BUNTING,-6,3/30/2011 14:49,8.5,15648,United Kingdom,3,-51
C548352,22179,SET 10 LIGHTS NIGHT OWL,-1,3/30/2011 14:57,6.75,12921,United Kingdom,3,-6.75
C548355,22748,POPPY'S PLAYHOUSE KITCHEN,-6,3/30/2011 15:06,2.1,12921,United Kingdom,3,-12.6
C548355,22698,PINK REGENCY TEACUP AND SAUCER,-6,3/30/2011 15:06,2.95,12921,United Kingdom,3,-17.7
C548355,22697,GREEN REGENCY TEACUP AND SAUCER,-6,3/30/2011 15:06,2.95,12921,United Kingdom,3,-17.7
C548355,22561,WOODEN SCHOOL COLOURING SET,-12,3/30/2011 15:06,1.65,12921,United Kingdom,3,-19.8
C548355,22423,REGENCY CAKESTAND 3 TIER,-1,3/30/2011 15:06,12.75,12921,United Kingdom,3,-12.75
C548356,22467,GUMBALL COAT RACK,-9,3/30/2011 15:12,2.55,12472,Germany,3,-22.95
C548356,22423,REGENCY CAKESTAND 3 TIER,-1,3/30/2011 15:12,12.75,12472,Germany,3,-12.75
C548356,22326,ROUND SNACK BOXES SET OF4 WOODLAND ,-1,3/30/2011 15:12,2.95,12472,Germany,3,-2.95
C548356,22444,GROW YOUR OWN PLANT IN A CAN ,-3,3/30/2011 15:12,1.25,12472,Germany,3,-3.75
C548356,21731,RED TOADSTOOL LED NIGHT LIGHT,-2,3/30/2011 15:12,1.65,12472,Germany,3,-3.3
C548356,21559,STRAWBERRY LUNCH BOX WITH CUTLERY,-3,3/30/2011 15:12,2.55,12472,Germany,3,-7.65
C548356,21383,PACK OF 12 STICKY BUNNIES,-2,3/30/2011 15:12,0.65,12472,Germany,3,-1.3
C548357,22423,REGENCY CAKESTAND 3 TIER,-1,3/30/2011 15:14,10.95,15785,United Kingdom,3,-10.95
C548360,22356,CHARLOTTE BAG PINK POLKADOT,-1,3/30/2011 15:35,0.85,13534,United Kingdom,3,-0.85
C548360,21929,JUMBO BAG PINK VINTAGE PAISLEY,-1,3/30/2011 15:35,2.08,13534,United Kingdom,3,-2.08
C548362,22355,CHARLOTTE BAG SUKI DESIGN,-10,3/30/2011 15:40,0.85,13268,United Kingdom,3,-8.5
C548374,84969,BOX OF 6 ASSORTED COLOUR TEASPOONS,-1,3/30/2011 16:36,4.25,13047,United Kingdom,3,-4.25
C548374,21658,GLASS  BEURRE DISH,-2,3/30/2011 16:36,3.95,13047,United Kingdom,3,-7.9
C548374,22969,HOMEMADE JAM SCENTED CANDLES,-2,3/30/2011 16:36,1.45,13047,United Kingdom,3,-2.9
C548375,22626,BLACK KITCHEN SCALES,-4,3/30/2011 16:39,8.5,14256,United Kingdom,3,-34
C548387,22849,BREAD BIN DINER STYLE MINT,-2,3/30/2011 16:49,16.95,14794,United Kingdom,3,-33.9
C548389,22423,REGENCY CAKESTAND 3 TIER,-1,3/30/2011 16:54,12.75,16713,United Kingdom,3,-12.75
C548389,22442,GROW YOUR OWN FLOWERS SET OF 3,-2,3/30/2011 16:54,7.95,16713,United Kingdom,3,-15.9
C548391,22698,PINK REGENCY TEACUP AND SAUCER,-1,3/30/2011 17:06,2.95,13488,United Kingdom,3,-2.95
C548392,21277,FRENCH STYLE EMBOSSED HEART CABINET,-1,3/30/2011 17:09,21.95,18075,United Kingdom,3,-21.95
C548453,22892,SET OF SALT AND PEPPER TOADSTOOLS,-6,3/31/2011 11:37,1.25,17428,United Kingdom,3,-7.5
C548454,M,Manual,-1,3/31/2011 11:42,5.7,16422,United Kingdom,3,-5.7
C548454,M,Manual,-1,3/31/2011 11:42,7.88,16422,United Kingdom,3,-7.88
C548454,M,Manual,-1,3/31/2011 11:42,0.22,16422,United Kingdom,3,-0.22
C548454,M,Manual,-1,3/31/2011 11:42,57.6,16422,United Kingdom,3,-57.6
C548456,M,Manual,-1,3/31/2011 11:49,57.6,16422,United Kingdom,3,-57.6
C548460,22426,ENAMEL WASH BOWL CREAM,-4,3/31/2011 11:58,3.75,16801,United Kingdom,3,-15
C548460,22425,ENAMEL COLANDER CREAM,-3,3/31/2011 11:58,4.95,16801,United Kingdom,3,-14.85
C548460,22413,METAL SIGN TAKE IT OR LEAVE IT ,-6,3/31/2011 11:58,2.95,16801,United Kingdom,3,-17.7
C548460,22366,DOORMAT AIRMAIL ,-2,3/31/2011 11:58,7.95,16801,United Kingdom,3,-15.9
C548460,22365,DOORMAT RESPECTABLE HOUSE,-2,3/31/2011 11:58,7.95,16801,United Kingdom,3,-15.9
C548460,22193,RED DINER WALL CLOCK,-2,3/31/2011 11:58,8.5,16801,United Kingdom,3,-17
C548460,22192,BLUE DINER WALL CLOCK,-2,3/31/2011 11:58,8.5,16801,United Kingdom,3,-17
C548460,22191,IVORY DINER WALL CLOCK,-2,3/31/2011 11:58,8.5,16801,United Kingdom,3,-17
C548460,21908,CHOCOLATE THIS WAY METAL SIGN,-12,3/31/2011 11:58,2.1,16801,United Kingdom,3,-25.2
C548460,21903,MAN FLU METAL SIGN,-12,3/31/2011 11:58,2.1,16801,United Kingdom,3,-25.2
C548460,21877,HOME SWEET HOME MUG,-12,3/31/2011 11:58,1.25,16801,United Kingdom,3,-15
C548460,21873,IF YOU CAN'T STAND THE HEAT MUG,-12,3/31/2011 11:58,1.25,16801,United Kingdom,3,-15
C548460,21868,POTTING SHED TEA MUG,-12,3/31/2011 11:58,1.25,16801,United Kingdom,3,-15
C548460,21745,GAOLERS KEYS DECORATIVE GARDEN ,-4,3/31/2011 11:58,3.75,16801,United Kingdom,3,-15
C548460,21622,VINTAGE UNION JACK CUSHION COVER,-4,3/31/2011 11:58,4.95,16801,United Kingdom,3,-19.8
C548460,21523,DOORMAT FANCY FONT HOME SWEET HOME,-2,3/31/2011 11:58,7.95,16801,United Kingdom,3,-15.9
C548460,48194,DOORMAT HEARTS,-2,3/31/2011 11:58,7.95,16801,United Kingdom,3,-15.9
C548460,48188,DOORMAT WELCOME PUPPIES,-2,3/31/2011 11:58,7.95,16801,United Kingdom,3,-15.9
C548460,48187,DOORMAT NEW ENGLAND,-2,3/31/2011 11:58,7.95,16801,United Kingdom,3,-15.9
C548460,48185,DOORMAT FAIRY CAKE,-2,3/31/2011 11:58,7.95,16801,United Kingdom,3,-15.9
C548460,48184,DOORMAT ENGLISH ROSE ,-2,3/31/2011 11:58,7.95,16801,United Kingdom,3,-15.9
C548460,48138,DOORMAT UNION FLAG,-2,3/31/2011 11:58,7.95,16801,United Kingdom,3,-15.9
C548460,48129,DOORMAT TOPIARY,-2,3/31/2011 11:58,7.95,16801,United Kingdom,3,-15.9
C548460,48111,DOORMAT 3 SMILEY CATS,-2,3/31/2011 11:58,7.95,16801,United Kingdom,3,-15.9
C548460,22990,COTTON APRON PANTRY DESIGN,-2,3/31/2011 11:58,4.95,16801,United Kingdom,3,-9.9
C548460,22980,PANTRY SCRUBBING BRUSH,-12,3/31/2011 11:58,1.65,16801,United Kingdom,3,-19.8
C548460,22979,PANTRY WASHING UP BRUSH,-12,3/31/2011 11:58,1.45,16801,United Kingdom,3,-17.4
C548460,22960,JAM MAKING SET WITH JARS,-6,3/31/2011 11:58,4.25,16801,United Kingdom,3,-25.5
C548460,22846,BREAD BIN DINER STYLE RED ,-1,3/31/2011 11:58,16.95,16801,United Kingdom,3,-16.95
C548460,22842,BISCUIT TIN VINTAGE RED,-2,3/31/2011 11:58,6.75,16801,United Kingdom,3,-13.5
C548460,22840,ROUND CAKE TIN VINTAGE RED,-2,3/31/2011 11:58,7.95,16801,United Kingdom,3,-15.9
C548460,22760,"TRAY, BREAKFAST IN BED",-1,3/31/2011 11:58,12.75,16801,United Kingdom,3,-12.75
C548460,22722,SET OF 6 SPICE TINS PANTRY DESIGN,-4,3/31/2011 11:58,3.95,16801,United Kingdom,3,-15.8
C548460,22720,SET OF 3 CAKE TINS PANTRY DESIGN ,-3,3/31/2011 11:58,4.95,16801,United Kingdom,3,-14.85
C548460,22692,DOORMAT WELCOME TO OUR HOME,-2,3/31/2011 11:58,7.95,16801,United Kingdom,3,-15.9
C548460,22691,DOORMAT WELCOME SUNRISE,-2,3/31/2011 11:58,7.95,16801,United Kingdom,3,-15.9
C548460,22690,DOORMAT HOME SWEET HOME BLUE ,-2,3/31/2011 11:58,7.95,16801,United Kingdom,3,-15.9
C548460,22626,BLACK KITCHEN SCALES,-2,3/31/2011 11:58,8.5,16801,United Kingdom,3,-17
C548460,22625,RED KITCHEN SCALES,-2,3/31/2011 11:58,8.5,16801,United Kingdom,3,-17
C548460,22624,IVORY KITCHEN SCALES,-2,3/31/2011 11:58,8.5,16801,United Kingdom,3,-17
C548460,22457,NATURAL SLATE HEART CHALKBOARD ,-6,3/31/2011 11:58,2.95,16801,United Kingdom,3,-17.7
C548460,22456,NATURAL SLATE CHALKBOARD LARGE ,-3,3/31/2011 11:58,4.95,16801,United Kingdom,3,-14.85
C548460,22430,ENAMEL WATERING CAN CREAM,-4,3/31/2011 11:58,4.95,16801,United Kingdom,3,-19.8
C548460,22429,ENAMEL MEASURING JUG CREAM,-4,3/31/2011 11:58,4.25,16801,United Kingdom,3,-17
C548460,22427,ENAMEL FLOWER JUG CREAM,-3,3/31/2011 11:58,5.95,16801,United Kingdom,3,-17.85
C548463,82483,WOOD 2 DRAWER CABINET WHITE FINISH,-18,3/31/2011 12:11,5.95,13225,United Kingdom,3,-107.1
C548463,82483,WOOD 2 DRAWER CABINET WHITE FINISH,-46,3/31/2011 12:11,5.95,13225,United Kingdom,3,-273.7
C548464,22846,BREAD BIN DINER STYLE RED ,-3,3/31/2011 12:14,14.95,13043,United Kingdom,3,-44.85
C548465,22776,SWEETHEART CAKESTAND 3 TIER,-23,3/31/2011 12:17,8.5,17526,United Kingdom,3,-195.5
C548467,22617,BAKING SET SPACEBOY DESIGN,-2,3/31/2011 12:20,4.95,16619,United Kingdom,3,-9.9
C548467,22502,PICNIC BASKET WICKER SMALL,-2,3/31/2011 12:20,5.95,16619,United Kingdom,3,-11.9
C548469,22624,IVORY KITCHEN SCALES,-4,3/31/2011 12:32,7.65,14543,United Kingdom,3,-30.6
C548469,21528,DAIRY MAID TRADITIONAL TEAPOT ,-2,3/31/2011 12:32,5.95,14543,United Kingdom,3,-11.9
C548469,21534,DAIRY MAID LARGE MILK JUG,-1,3/31/2011 12:32,4.95,14543,United Kingdom,3,-4.95
C548469,21781,MA CAMPAGNE CUTLERY BOX,-7,3/31/2011 12:32,12.75,14543,United Kingdom,3,-89.25
C548469,21843,RED RETROSPOT CAKE STAND,-1,3/31/2011 12:32,9.95,14543,United Kingdom,3,-9.95
C548469,M,Manual,-1,3/31/2011 12:32,12.75,14543,United Kingdom,3,-12.75
C548469,21258,VICTORIAN SEWING BOX LARGE,-4,3/31/2011 12:32,12.75,14543,United Kingdom,3,-51
C548469,22207,FRYING PAN UNION FLAG,-1,3/31/2011 12:32,4.25,14543,United Kingdom,3,-4.25
C548469,M,Manual,-2,3/31/2011 12:32,10.95,14543,United Kingdom,3,-21.9
C548469,22625,RED KITCHEN SCALES,-2,3/31/2011 12:32,7.65,14543,United Kingdom,3,-15.3
C548469,22627,MINT KITCHEN SCALES,-1,3/31/2011 12:32,0.76,14543,United Kingdom,3,-0.76
C548469,22624,IVORY KITCHEN SCALES,-4,3/31/2011 12:32,7.65,14543,United Kingdom,3,-30.6
C548471,22776,SWEETHEART CAKESTAND 3 TIER,-1,3/31/2011 12:38,9.95,14267,United Kingdom,3,-9.95
C548485,22699,ROSES REGENCY TEACUP AND SAUCER ,-1,3/31/2011 12:50,2.95,14051,United Kingdom,3,-2.95
C548485,22698,PINK REGENCY TEACUP AND SAUCER,-2,3/31/2011 12:50,2.95,14051,United Kingdom,3,-5.9
C548487,22798,ANTIQUE GLASS DRESSING TABLE POT,-1,3/31/2011 12:57,2.95,14952,United Kingdom,3,-2.95
C548487,22667,RECIPE BOX RETROSPOT ,-1,3/31/2011 12:57,2.95,14952,United Kingdom,3,-2.95
C548487,22637,PIGGY BANK RETROSPOT ,-8,3/31/2011 12:57,2.55,14952,United Kingdom,3,-20.4
C548488,22891,TEA FOR ONE POLKADOT,-1,3/31/2011 13:03,4.25,16638,United Kingdom,3,-4.25
C548495,21528,DAIRY MAID TRADITIONAL TEAPOT ,-1,3/31/2011 13:34,6.95,17075,United Kingdom,3,-6.95
C548495,21527,RED RETROSPOT TRADITIONAL TEAPOT ,-1,3/31/2011 13:34,7.95,17075,United Kingdom,3,-7.95
C548495,71038,WHITE HANGING BEADS CANDLE HOLDER,-1,3/31/2011 13:34,5.45,17075,United Kingdom,3,-5.45
C548503,22072,RED RETROSPOT TEA CUP AND SAUCER ,-1,3/31/2011 14:23,3.75,14410,United Kingdom,3,-3.75
C548503,21539,RED RETROSPOT BUTTER DISH,-1,3/31/2011 14:23,4.95,14410,United Kingdom,3,-4.95
C548503,22070,SMALL RED RETROSPOT MUG IN BOX ,-1,3/31/2011 14:23,3.75,14410,United Kingdom,3,-3.75
C548503,22071,SMALL WHITE RETROSPOT MUG IN BOX ,-2,3/31/2011 14:23,3.75,14410,United Kingdom,3,-7.5
C548503,22649,STRAWBERRY FAIRY CAKE TEAPOT,-2,3/31/2011 14:23,4.95,14410,United Kingdom,3,-9.9
C548508,23176,ABC TREASURE BOOK BOX ,-1,3/31/2011 14:51,2.25,14189,United Kingdom,3,-2.25
C548513,85123A,WHITE HANGING HEART T-LIGHT HOLDER,-8,3/31/2011 15:54,2.55,13777,United Kingdom,3,-20.4
C548532,84406B,CREAM CUPID HEARTS COAT HANGER,-24,3/31/2011 17:16,4.15,14031,United Kingdom,3,-99.6
C548532,22423,REGENCY CAKESTAND 3 TIER,-48,3/31/2011 17:16,10.95,14031,United Kingdom,3,-525.6
C548532,82482,WOODEN PICTURE FRAME WHITE FINISH,-24,3/31/2011 17:16,2.55,14031,United Kingdom,3,-61.2
C548532,82494L,WOODEN FRAME ANTIQUE WHITE ,-96,3/31/2011 17:16,2.55,14031,United Kingdom,3,-244.8
C548532,21843,RED RETROSPOT CAKE STAND,-24,3/31/2011 17:16,9.95,14031,United Kingdom,3,-238.8
C548543,84949,SILVER HANGING T-LIGHT HOLDER,-2,3/31/2011 18:44,1.65,14525,United Kingdom,3,-3.3
C548543,M,Manual,-12,3/31/2011 18:44,3.75,14525,United Kingdom,3,-45
C548564,20750,RED RETROSPOT MINI CASES,-1,4/1/2011 10:22,7.95,12616,France,4,-7.95
C548573,22762,CUPBOARD 3 DRAWER MA CAMPAGNE,-8,4/1/2011 10:45,12.75,15045,United Kingdom,4,-102
C548576,84632,DECORATIVE HANGING SHELVING UNIT,-1,4/1/2011 10:46,59.95,15696,United Kingdom,4,-59.95
C548576,22487,WHITE WOOD GARDEN PLANT LADDER,-1,4/1/2011 10:46,9.95,15696,United Kingdom,4,-9.95
C548576,84969,BOX OF 6 ASSORTED COLOUR TEASPOONS,-1,4/1/2011 10:46,4.25,15696,United Kingdom,4,-4.25
C548577,21154,RED RETROSPOT OVEN GLOVE ,-200,4/1/2011 10:46,1.06,13694,United Kingdom,4,-212
C548577,21873,IF YOU CAN'T STAND THE HEAT MUG,-72,4/1/2011 10:46,1.06,13694,United Kingdom,4,-76.32
C548577,22659,LUNCH BOX I LOVE LONDON,-64,4/1/2011 10:46,1.65,13694,United Kingdom,4,-105.6
C548577,21155,RED RETROSPOT PEG BAG,-200,4/1/2011 10:46,2.1,13694,United Kingdom,4,-420
C548577,21210,SET OF 72 RETROSPOT PAPER  DOILIES,-96,4/1/2011 10:46,1.25,13694,United Kingdom,4,-120
C548607,22637,PIGGY BANK RETROSPOT ,-1,4/1/2011 11:20,2.55,16700,United Kingdom,4,-2.55
C548609,21277,FRENCH STYLE EMBOSSED HEART CABINET,-1,4/1/2011 11:22,21.95,15589,United Kingdom,4,-21.95
C548625,21463,MIRRORED DISCO BALL ,-2,4/1/2011 12:14,5.95,13078,United Kingdom,4,-11.9
C548626,22193,RED DINER WALL CLOCK,-1,4/1/2011 12:16,8.5,15622,United Kingdom,4,-8.5
C548628,21820,GLITTER HEART GARLAND WITH BELLS ,-6,4/1/2011 12:19,3.75,13184,United Kingdom,4,-22.5
C548647,37449,CERAMIC CAKE STAND + HANGING CAKES,-3,4/1/2011 13:17,9.95,12888,United Kingdom,4,-29.85
C548667,22231,JIGSAW TREE WITH BIRDHOUSE,-15,4/1/2011 15:00,1.45,12781,Czech Republic,4,-21.75
C548667,84459A,PINK METAL CHICKEN HEART ,-24,4/1/2011 15:00,1.49,12781,Czech Republic,4,-35.76
C548695,82483,WOOD 2 DRAWER CABINET WHITE FINISH,-1,4/3/2011 10:08,6.95,17243,United Kingdom,4,-6.95
C548695,82486,WOOD S/3 CABINET ANT WHITE FINISH,-1,4/3/2011 10:08,8.95,17243,United Kingdom,4,-8.95
C548695,37449,CERAMIC CAKE STAND + HANGING CAKES,-1,4/3/2011 10:08,9.95,17243,United Kingdom,4,-9.95
C548713,22181,SNOWSTORM PHOTO FRAME FRIDGE MAGNET,-3,4/3/2011 14:53,0.85,17337,United Kingdom,4,-2.55
C548713,22087,PAPER BUNTING WHITE LACE,-12,4/3/2011 14:53,2.95,17337,United Kingdom,4,-35.4
C548713,21877,HOME SWEET HOME MUG,-1,4/3/2011 14:53,1.25,17337,United Kingdom,4,-1.25
C548717,22418,10 COLOUR SPACEBOY PEN,-24,4/4/2011 8:50,0.85,16297,United Kingdom,4,-20.4
C548721,21714,CITRONELLA CANDLE GARDEN POT,-4,4/4/2011 8:59,1.25,12957,United Kingdom,4,-5
C548721,21713,CITRONELLA CANDLE FLOWERPOT,-2,4/4/2011 8:59,2.1,12957,United Kingdom,4,-4.2
C548722,22960,JAM MAKING SET WITH JARS,-2,4/4/2011 9:00,4.25,13481,United Kingdom,4,-8.5
C548723,72741,GRAND CHOCOLATECANDLE,-3,4/4/2011 9:02,1.45,15874,United Kingdom,4,-4.35
C548723,20830,SILVER PHOTO FRAME,-1,4/4/2011 9:02,2.1,15874,United Kingdom,4,-2.1
C548723,84755,COLOUR GLASS T-LIGHT HOLDER HANGING,-1,4/4/2011 9:02,0.65,15874,United Kingdom,4,-0.65
C548723,82482,WOODEN PICTURE FRAME WHITE FINISH,-1,4/4/2011 9:02,2.55,15874,United Kingdom,4,-2.55
C548723,85063,CREAM SWEETHEART MAGAZINE RACK,-1,4/4/2011 9:02,16.95,15874,United Kingdom,4,-16.95
C548724,22690,DOORMAT HOME SWEET HOME BLUE ,-2,4/4/2011 9:04,7.95,15632,United Kingdom,4,-15.9
C548727,22325,MOBILE VINTAGE HEARTS ,-2,4/4/2011 9:45,4.95,17725,United Kingdom,4,-9.9
C548727,85159A,"BLACK TEA,COFFEE,SUGAR JARS",-2,4/4/2011 9:45,1.95,17725,United Kingdom,4,-3.9
C548729,22232,JIGSAW TOADSTOOLS 3 PIECE,-8,4/4/2011 9:57,1.65,12434,Australia,4,-13.2
C548731,22328,ROUND SNACK BOXES SET OF 4 FRUITS ,-624,4/4/2011 10:12,2.55,12755,Japan,4,-1591.2
C548738,22302,COFFEE MUG PEARS  DESIGN,-6,4/4/2011 11:22,2.55,14711,United Kingdom,4,-15.3
C548738,22303,COFFEE MUG APPLES DESIGN,-6,4/4/2011 11:22,2.55,14711,United Kingdom,4,-15.3
C548748,84755,COLOUR GLASS T-LIGHT HOLDER HANGING,-16,4/4/2011 12:28,0.65,15223,United Kingdom,4,-10.4
C548748,22960,JAM MAKING SET WITH JARS,-6,4/4/2011 12:28,4.25,15223,United Kingdom,4,-25.5
C548748,22722,SET OF 6 SPICE TINS PANTRY DESIGN,-4,4/4/2011 12:28,3.95,15223,United Kingdom,4,-15.8
C548748,22666,RECIPE BOX PANTRY YELLOW DESIGN,-6,4/4/2011 12:28,2.95,15223,United Kingdom,4,-17.7
C548748,22654,DELUXE SEWING KIT ,-6,4/4/2011 12:28,5.95,15223,United Kingdom,4,-35.7
C548748,22423,REGENCY CAKESTAND 3 TIER,-8,4/4/2011 12:28,12.75,15223,United Kingdom,4,-102
C548748,22178,VICTORIAN GLASS HANGING T-LIGHT,-12,4/4/2011 12:28,1.25,15223,United Kingdom,4,-15
C548748,22149,FELTCRAFT 6 FLOWER FRIENDS,-6,4/4/2011 12:28,2.1,15223,United Kingdom,4,-12.6
C548748,21937,STRAWBERRY   PICNIC BAG,-5,4/4/2011 12:28,2.95,15223,United Kingdom,4,-14.75
C548748,21931,JUMBO STORAGE BAG SUKI,-10,4/4/2011 12:28,2.08,15223,United Kingdom,4,-20.8
