InvoiceNo,StockCode,Description,Quantity,InvoiceDate,UnitPrice,CustomerID,Country,Month,Total cost
C569655,23188,VINTAGE  2 METRE FOLDING RULER,-1,10/5/2011 12:58,1.65,14534,United Kingdom,10,-1.65
C569655,22961,JAM MAKING SET PRINTED,-1,10/5/2011 12:58,1.45,14534,United Kingdom,10,-1.45
C569655,23309,SET OF 60 I LOVE LONDON CAKE CASES ,-1,10/5/2011 12:58,0.55,14534,United Kingdom,10,-0.55
C569655,22911,PAPER CHAIN KIT LONDON,-3,10/5/2011 12:58,2.95,14534,United Kingdom,10,-8.85
C569655,23207,LUNCH BAG ALPHABET DESIGN,-2,10/5/2011 12:58,1.65,14534,United Kingdom,10,-3.3
C569655,22383,LUNCH BAG SUKI DESIGN ,-2,10/5/2011 12:58,1.65,14534,United Kingdom,10,-3.3
C569655,22477,WATERING CAN GARDEN MARKER,-1,10/5/2011 12:58,1.25,14534,United Kingdom,10,-1.25
C569655,23302,KNEELING MAT HOUSEWORK  DESIGN,-1,10/5/2011 12:58,1.65,14534,United Kingdom,10,-1.65
C569655,23300,GARDENERS KNEELING PAD CUP OF TEA ,-2,10/5/2011 12:58,1.65,14534,United Kingdom,10,-3.3
C569655,23301,GARDENERS KNEELING PAD KEEP CALM ,-1,10/5/2011 12:58,1.65,14534,United Kingdom,10,-1.65
C569655,22963,JAM JAR WITH GREEN LID,-12,10/5/2011 12:58,0.85,14534,United Kingdom,10,-10.2
C569655,22993,SET OF 4 PANTRY JELLY MOULDS,-3,10/5/2011 12:58,1.25,14534,United Kingdom,10,-3.75
C569655,22962,JAM JAR WITH PINK LID,-12,10/5/2011 12:58,0.85,14534,United Kingdom,10,-10.2
C569655,22659,LUNCH BOX I LOVE LONDON,-2,10/5/2011 12:58,1.95,14534,United Kingdom,10,-3.9
C569655,22964,3 PIECE SPACEBOY COOKIE CUTTER SET,-1,10/5/2011 12:58,2.1,14534,United Kingdom,10,-2.1
C569655,22382,LUNCH BAG SPACEBOY DESIGN ,-7,10/5/2011 12:58,1.65,14534,United Kingdom,10,-11.55
C569655,22961,JAM MAKING SET PRINTED,-2,10/5/2011 12:58,1.45,14534,United Kingdom,10,-2.9
C569655,22966,GINGERBREAD MAN COOKIE CUTTER,-2,10/5/2011 12:58,1.25,14534,United Kingdom,10,-2.5
C569655,22991,GIRAFFE WOODEN RULER,-2,10/5/2011 12:58,1.95,14534,United Kingdom,10,-3.9
C569655,22992,REVOLVER WOODEN RULER ,-3,10/5/2011 12:58,1.95,14534,United Kingdom,10,-5.85
C569663,21925,UNION STRIPE CUSHION COVER ,-2,10/5/2011 13:29,1.25,17841,United Kingdom,10,-2.5
C569663,21381,MINI WOODEN HAPPY BIRTHDAY GARLAND,-1,10/5/2011 13:29,1.69,17841,United Kingdom,10,-1.69
C569663,21670,BLUE SPOT CERAMIC DRAWER KNOB,-1,10/5/2011 13:29,1.45,17841,United Kingdom,10,-1.45
C569682,23239,SET OF 4 KNICK KNACK TINS POPPIES,-6,10/5/2011 14:33,4.15,15351,United Kingdom,10,-24.9
C569682,11001,ASSTD DESIGN RACING CAR PEN,-2,10/5/2011 14:33,1.69,15351,United Kingdom,10,-3.38
C569682,23397,FOOT STOOL HOME SWEET HOME ,-1,10/5/2011 14:33,9.95,15351,United Kingdom,10,-9.95
C569682,84968C,SET OF 16 VINTAGE PISTACHIO CUTLERY,-1,10/5/2011 14:33,12.75,15351,United Kingdom,10,-12.75
C569733,78033,FLAG OF ST GEORGE CHAIR,-2,10/6/2011 9:57,5.95,12500,Germany,10,-11.9
C569743,20713,JUMBO BAG OWLS,-30,10/6/2011 10:57,2.08,15769,United Kingdom,10,-62.4
C569743,23199,JUMBO BAG APPLES,-120,10/6/2011 10:57,1.79,15769,United Kingdom,10,-214.8
C569743,23200,JUMBO BAG PEARS,-120,10/6/2011 10:57,1.79,15769,United Kingdom,10,-214.8
C569743,22389,PAPERWEIGHT SAVE THE PLANET,-100,10/6/2011 10:57,2.1,15769,United Kingdom,10,-210
C569743,85099B,JUMBO BAG RED RETROSPOT,-140,10/6/2011 10:57,1.79,15769,United Kingdom,10,-250.6
C569743,85099F,JUMBO BAG STRAWBERRY,-120,10/6/2011 10:57,1.79,15769,United Kingdom,10,-214.8
C569743,23202,JUMBO BAG VINTAGE LEAF,-110,10/6/2011 10:57,1.79,15769,United Kingdom,10,-196.9
C569743,85099C,JUMBO  BAG BAROQUE BLACK WHITE,-130,10/6/2011 10:57,1.79,15769,United Kingdom,10,-232.7
C569743,21928,JUMBO BAG SCANDINAVIAN BLUE PAISLEY,-100,10/6/2011 10:57,1.79,15769,United Kingdom,10,-179
C569743,23201,JUMBO BAG ALPHABET,-110,10/6/2011 10:57,1.79,15769,United Kingdom,10,-196.9
C569743,21929,JUMBO BAG PINK VINTAGE PAISLEY,-100,10/6/2011 10:57,1.79,15769,United Kingdom,10,-179
C569743,23343,JUMBO BAG VINTAGE CHRISTMAS ,-40,10/6/2011 10:57,2.08,15769,United Kingdom,10,-83.2
C569743,23344,JUMBO BAG 50'S CHRISTMAS ,-30,10/6/2011 10:57,2.08,15769,United Kingdom,10,-62.4
C569743,22411,JUMBO SHOPPER VINTAGE RED PAISLEY,-130,10/6/2011 10:57,1.79,15769,United Kingdom,10,-232.7
C569743,23203,JUMBO BAG VINTAGE DOILY ,-220,10/6/2011 10:57,1.79,15769,United Kingdom,10,-393.8
C569786,22794,SWEETHEART WIRE MAGAZINE RACK,-1,10/6/2011 11:40,7.95,17813,United Kingdom,10,-7.95
C569851,21537,RED RETROSPOT PUDDING BOWL,-1,10/6/2011 14:02,3.75,17511,United Kingdom,10,-3.75
C569851,22197,POPCORN HOLDER,-1,10/6/2011 14:02,0.72,17511,United Kingdom,10,-0.72
C569851,22384,LUNCH BAG PINK POLKADOT,-1,10/6/2011 14:02,1.45,17511,United Kingdom,10,-1.45
C569851,20725,LUNCH BAG RED RETROSPOT,-1,10/6/2011 14:02,1.45,17511,United Kingdom,10,-1.45
C569851,23209,LUNCH BAG VINTAGE DOILY ,-1,10/6/2011 14:02,1.45,17511,United Kingdom,10,-1.45
C569851,22605,WOODEN CROQUET GARDEN SET,-1,10/6/2011 14:02,12.75,17511,United Kingdom,10,-12.75
C569891,84609,TALL ROCOCO CANDLE HOLDER,-2,10/6/2011 15:46,8.5,13924,United Kingdom,10,-17
C569891,23407,SET OF 2 TRAYS HOME SWEET HOME,-2,10/6/2011 15:46,9.95,13924,United Kingdom,10,-19.9
C569891,23263,SET OF 3 WOODEN HEART DECORATIONS,-1,10/6/2011 15:46,1.25,13924,United Kingdom,10,-1.25
C569891,23165,LARGE CERAMIC TOP STORAGE JAR,-2,10/6/2011 15:46,1.65,13924,United Kingdom,10,-3.3
C569891,22720,SET OF 3 CAKE TINS PANTRY DESIGN ,-2,10/6/2011 15:46,4.95,13924,United Kingdom,10,-9.9
C569891,22588,CARD HOLDER GINGHAM HEART,-1,10/6/2011 15:46,2.89,13924,United Kingdom,10,-2.89
C569891,22294,HEART FILIGREE DOVE  SMALL,-8,10/6/2011 15:46,1.25,13924,United Kingdom,10,-10
C569891,21722,SWEET PUDDING STICKER SHEET,-1,10/6/2011 15:46,0.85,13924,United Kingdom,10,-0.85
C569902,23092,LARGE ANTIQUE WHITE PHOTO FRAME,-1,10/6/2011 16:20,7.9,13647,United Kingdom,10,-7.9
C569908,23322,LARGE WHITE HEART OF WICKER,-2,10/6/2011 16:41,2.95,16782,United Kingdom,10,-5.9
C569909,22891,TEA FOR ONE POLKADOT,-1,10/6/2011 16:43,4.25,17611,United Kingdom,10,-4.25
C569909,22169,FAMILY ALBUM WHITE PICTURE FRAME,-1,10/6/2011 16:43,8.5,17611,United Kingdom,10,-8.5
C569911,23236,STORAGE TIN VINTAGE DOILY ,-1,10/6/2011 16:47,2.89,16653,United Kingdom,10,-2.89
C569911,23245,SET OF 3 REGENCY CAKE TINS,-2,10/6/2011 16:47,4.95,16653,United Kingdom,10,-9.9
C569911,22720,SET OF 3 CAKE TINS PANTRY DESIGN ,-3,10/6/2011 16:47,4.95,16653,United Kingdom,10,-14.85
C569911,23079,TOADSTOOL BEDSIDE LIGHT ,-1,10/6/2011 16:47,8.95,16653,United Kingdom,10,-8.95
C569911,22699,ROSES REGENCY TEACUP AND SAUCER ,-1,10/6/2011 16:47,2.95,16653,United Kingdom,10,-2.95
C569911,21534,DAIRY MAID LARGE MILK JUG,-1,10/6/2011 16:47,4.95,16653,United Kingdom,10,-4.95
C569911,84946,ANTIQUE SILVER T-LIGHT GLASS,-1,10/6/2011 16:47,1.25,16653,United Kingdom,10,-1.25
C569913,22784,LANTERN CREAM GAZEBO ,-1,10/6/2011 16:50,4.95,14217,United Kingdom,10,-4.95
C569916,22646,CERAMIC STRAWBERRY CAKE MONEY BANK,-8,10/6/2011 17:00,1.25,13777,United Kingdom,10,-10
C569922,22728,ALARM CLOCK BAKELIKE PINK,-1,10/6/2011 17:38,3.75,16842,United Kingdom,10,-3.75
C569938,22726,ALARM CLOCK BAKELIKE GREEN,-1,10/6/2011 17:55,3.75,14211,United Kingdom,10,-3.75
C569939,22784,LANTERN CREAM GAZEBO ,-1,10/6/2011 17:57,4.95,14883,United Kingdom,10,-4.95
C569940,23084,RABBIT NIGHT LIGHT,-4,10/6/2011 18:00,1.79,15611,United Kingdom,10,-7.16
C569941,23412,HEART MIRROR ANTIQUE WHITE,-2,10/6/2011 18:06,7.5,16909,United Kingdom,10,-15
C569942,22842,BISCUIT TIN VINTAGE RED,-2,10/6/2011 18:08,6.75,14907,United Kingdom,10,-13.5
C569944,23425,STORAGE TIN HOME SWEET HOME,-2,10/6/2011 18:12,2.49,17405,United Kingdom,10,-4.98
C569944,22720,SET OF 3 CAKE TINS PANTRY DESIGN ,-1,10/6/2011 18:12,4.95,17405,United Kingdom,10,-4.95
C569944,22364,GLASS JAR DIGESTIVE BISCUITS,-1,10/6/2011 18:12,2.95,17405,United Kingdom,10,-2.95
C569944,22362,GLASS JAR PEACOCK BATH SALTS,-3,10/6/2011 18:12,2.95,17405,United Kingdom,10,-8.85
C569944,22357,KINGS CHOICE BISCUIT TIN,-2,10/6/2011 18:12,4.25,17405,United Kingdom,10,-8.5
C569945,22720,SET OF 3 CAKE TINS PANTRY DESIGN ,-2,10/6/2011 18:14,4.95,14141,United Kingdom,10,-9.9
C569945,21875,KINGS CHOICE MUG,-1,10/6/2011 18:14,1.25,14141,United Kingdom,10,-1.25
C569946,22487,WHITE WOOD GARDEN PLANT LADDER,-4,10/6/2011 18:16,8.5,16462,United Kingdom,10,-34
C569949,23243,SET OF TEA COFFEE SUGAR TINS PANTRY,-2,10/6/2011 18:27,4.95,12584,Italy,10,-9.9
C569949,22960,JAM MAKING SET WITH JARS,-1,10/6/2011 18:27,4.25,12584,Italy,10,-4.25
C569949,22845,VINTAGE CREAM CAT FOOD CONTAINER,-1,10/6/2011 18:27,6.35,12584,Italy,10,-6.35
C569949,22844,VINTAGE CREAM DOG FOOD CONTAINER,-2,10/6/2011 18:27,8.5,12584,Italy,10,-17
C569949,22804,CANDLEHOLDER PINK HANGING HEART,-2,10/6/2011 18:27,2.95,12584,Italy,10,-5.9
C569949,22720,SET OF 3 CAKE TINS PANTRY DESIGN ,-1,10/6/2011 18:27,4.95,12584,Italy,10,-4.95
C569950,22470,HEART OF WICKER LARGE,-1,10/6/2011 18:28,2.95,13499,United Kingdom,10,-2.95
C569951,23002,TRAVEL CARD WALLET SKULLS,-18,10/6/2011 18:29,0.42,16394,United Kingdom,10,-7.56
C569951,23000,TRAVEL CARD WALLET TRANSPORT,-2,10/6/2011 18:29,0.42,16394,United Kingdom,10,-0.84
C569952,23203,JUMBO BAG VINTAGE DOILY ,-2,10/6/2011 18:30,2.08,16160,United Kingdom,10,-4.16
C569953,21925,UNION STRIPE CUSHION COVER ,-2,10/6/2011 18:31,1.25,15841,United Kingdom,10,-2.5
C569953,21926,RED/CREAM STRIPE CUSHION COVER ,-2,10/6/2011 18:31,1.25,15841,United Kingdom,10,-2.5
C569954,47594A,CAROUSEL DESIGN WASHBAG,-1,10/6/2011 18:34,1.95,14792,United Kingdom,10,-1.95
C569954,22371,AIRLINE BAG VINTAGE TOKYO 78,-1,10/6/2011 18:34,4.25,14792,United Kingdom,10,-4.25
C569955,23110,PARISIENNE KEY CABINET ,-2,10/6/2011 18:35,5.75,17644,United Kingdom,10,-11.5
C569955,23322,LARGE WHITE HEART OF WICKER,-2,10/6/2011 18:35,2.95,17644,United Kingdom,10,-5.9
C569956,82482,WOODEN PICTURE FRAME WHITE FINISH,-6,10/6/2011 18:36,2.95,14944,United Kingdom,10,-17.7
C569957,22666,RECIPE BOX PANTRY YELLOW DESIGN,-3,10/6/2011 18:37,2.95,15745,United Kingdom,10,-8.85
C569958,23292,SPACEBOY CHILDRENS CUP,-8,10/6/2011 18:38,1.25,13266,United Kingdom,10,-10
C569959,23123,COCKTAIL SWORDS 50 PIECES,-3,10/6/2011 18:39,0.83,13983,United Kingdom,10,-2.49
C569959,23224,CHERUB HEART DECORATION GOLD,-2,10/6/2011 18:39,0.83,13983,United Kingdom,10,-1.66
C569959,23327,HANGING CLEAR MINI BOTTLE,-4,10/6/2011 18:39,0.63,13983,United Kingdom,10,-2.52
C569959,23328,SET 6 SCHOOL MILK BOTTLES IN CRATE,-1,10/6/2011 18:39,3.75,13983,United Kingdom,10,-3.75
C569959,22197,POPCORN HOLDER,-3,10/6/2011 18:39,0.85,13983,United Kingdom,10,-2.55
C569960,23203,JUMBO BAG VINTAGE DOILY ,-1,10/6/2011 18:40,2.08,18172,United Kingdom,10,-2.08
C569960,22729,ALARM CLOCK BAKELIKE ORANGE,-1,10/6/2011 18:40,3.75,18172,United Kingdom,10,-3.75
C569961,22960,JAM MAKING SET WITH JARS,-3,10/6/2011 18:44,4.25,13704,United Kingdom,10,-12.75
C569963,22636,CHILDS BREAKFAST SET CIRCUS PARADE,-3,10/6/2011 18:45,8.5,13131,United Kingdom,10,-25.5
C569963,22634,CHILDS BREAKFAST SET SPACEBOY ,-1,10/6/2011 18:45,8.5,13131,United Kingdom,10,-8.5
C569964,23032,DRAWER KNOB CRACKLE GLAZE IVORY,-1,10/6/2011 18:46,1.65,16523,United Kingdom,10,-1.65
C569966,22891,TEA FOR ONE POLKADOT,-2,10/6/2011 18:51,4.25,13279,United Kingdom,10,-8.5
C569966,22698,PINK REGENCY TEACUP AND SAUCER,-1,10/6/2011 18:51,2.95,13279,United Kingdom,10,-2.95
C569967,23250,VINTAGE RED TRIM ENAMEL BOWL ,-7,10/6/2011 18:54,1.04,17490,United Kingdom,10,-7.28
C569967,22429,ENAMEL MEASURING JUG CREAM,-1,10/6/2011 18:54,4.25,17490,United Kingdom,10,-4.25
C569967,23249,VINTAGE RED ENAMEL TRIM PLATE,-8,10/6/2011 18:54,1.45,17490,United Kingdom,10,-11.6
C569969,23240,SET OF 4 KNICK KNACK TINS DOILY ,-1,10/6/2011 18:56,4.15,17159,United Kingdom,10,-4.15
C569970,23240,SET OF 4 KNICK KNACK TINS DOILY ,-2,10/6/2011 18:57,4.15,13055,United Kingdom,10,-8.3
C569970,23239,SET OF 4 KNICK KNACK TINS POPPIES,-1,10/6/2011 18:57,4.15,13055,United Kingdom,10,-4.15
C569971,23247,BISCUIT TIN 50'S CHRISTMAS,-3,10/6/2011 19:20,2.89,16875,United Kingdom,10,-8.67
C569971,23301,GARDENERS KNEELING PAD KEEP CALM ,-2,10/6/2011 19:20,1.65,16875,United Kingdom,10,-3.3
C569971,23000,TRAVEL CARD WALLET TRANSPORT,-2,10/6/2011 19:20,0.42,16875,United Kingdom,10,-0.84
C569972,23111,PARISIENNE SEWING BOX,-1,10/6/2011 19:21,12.5,13317,United Kingdom,10,-12.5
C569973,22328,ROUND SNACK BOXES SET OF 4 FRUITS ,-3,10/6/2011 19:23,2.95,12703,Germany,10,-8.85
C569974,23241,TREASURE TIN GYMKHANA DESIGN,-2,10/6/2011 19:24,2.08,14092,United Kingdom,10,-4.16
C569975,23118,PARISIENNE JEWELLERY DRAWER ,-1,10/6/2011 19:25,7.5,14333,United Kingdom,10,-7.5
C569975,23111,PARISIENNE SEWING BOX,-1,10/6/2011 19:25,12.5,14333,United Kingdom,10,-12.5
C569975,23071,MARIE ANTOINETTE TRINKET BOX GOLD,-3,10/6/2011 19:25,12.5,14333,United Kingdom,10,-37.5
C569975,23056,FLOWERS CHANDELIER T-LIGHT HOLDER,-1,10/6/2011 19:25,6.25,14333,United Kingdom,10,-6.25
C569976,84949,SILVER HANGING T-LIGHT HOLDER,-3,10/6/2011 19:26,1.65,16747,United Kingdom,10,-4.95
C569976,22963,JAM JAR WITH GREEN LID,-1,10/6/2011 19:26,0.85,16747,United Kingdom,10,-0.85
C569978,22867,HAND WARMER BIRD DESIGN,-12,10/6/2011 19:27,2.1,13988,United Kingdom,10,-25.2
C569979,23494,VINTAGE DOILY DELUXE SEWING KIT ,-3,10/6/2011 19:29,5.95,17652,United Kingdom,10,-17.85
C569980,23089,GLASS BON BON JAR,-3,10/6/2011 19:31,1.95,13767,United Kingdom,10,-5.85
C569980,23342,MINT DINER WALL CLOCK,-1,10/6/2011 19:31,8.5,13767,United Kingdom,10,-8.5
C569981,22312,OFFICE MUG WARMER POLKADOT,-2,10/6/2011 19:36,2.95,12679,France,10,-5.9
C569981,22314,OFFICE MUG WARMER CHOC+BLUE,-2,10/6/2011 19:36,2.95,12679,France,10,-5.9
C569982,M,Manual,-1,10/6/2011 19:39,218.72,15365,United Kingdom,10,-218.72
C569984,22166,WALL MIRROR RECTANGLE DIAMANTE PINK,-1,10/6/2011 19:50,7.95,17231,United Kingdom,10,-7.95
C569985,22301,COFFEE MUG CAT + BIRD DESIGN,-6,10/6/2011 19:51,2.55,15365,United Kingdom,10,-15.3
C569985,22300,COFFEE MUG DOG + BALL DESIGN,-6,10/6/2011 19:51,2.55,15365,United Kingdom,10,-15.3
C569985,22139,RETROSPOT TEA SET CERAMIC 11 PC ,-3,10/6/2011 19:51,4.95,15365,United Kingdom,10,-14.85
C569985,21915,RED  HARMONICA IN BOX ,-12,10/6/2011 19:51,1.25,15365,United Kingdom,10,-15
C569985,21495,SKULLS AND CROSSBONES WRAP,-25,10/6/2011 19:51,0.42,15365,United Kingdom,10,-10.5
C569985,20727,LUNCH BAG  BLACK SKULL.,-10,10/6/2011 19:51,1.65,15365,United Kingdom,10,-16.5
C569985,20725,LUNCH BAG RED RETROSPOT,-10,10/6/2011 19:51,1.65,15365,United Kingdom,10,-16.5
C569985,16161U,WRAP SUKI AND FRIENDS,-25,10/6/2011 19:51,0.42,15365,United Kingdom,10,-10.5
C569985,23254,CHILDRENS CUTLERY DOLLY GIRL ,-4,10/6/2011 19:51,4.15,15365,United Kingdom,10,-16.6
C569985,84879,ASSORTED COLOUR BIRD ORNAMENT,-16,10/6/2011 19:51,1.69,15365,United Kingdom,10,-27.04
C569985,84380,SET OF 3 BUTTERFLY COOKIE CUTTERS,-12,10/6/2011 19:51,1.25,15365,United Kingdom,10,-15
C569985,84375,SET OF 20 KIDS COOKIE CUTTERS,-12,10/6/2011 19:51,2.1,15365,United Kingdom,10,-25.2
C569985,71053,WHITE METAL LANTERN,-8,10/6/2011 19:51,3.75,15365,United Kingdom,10,-30
C569985,23338,EGG FRYING PAN RED ,-6,10/6/2011 19:51,2.08,15365,United Kingdom,10,-12.48
C569985,23335,EGG FRYING PAN IVORY ,-6,10/6/2011 19:51,2.08,15365,United Kingdom,10,-12.48
C569985,23256,CHILDRENS CUTLERY SPACEBOY ,-4,10/6/2011 19:51,4.15,15365,United Kingdom,10,-16.6
C569985,23255,CHILDRENS CUTLERY CIRCUS PARADE,-4,10/6/2011 19:51,4.15,15365,United Kingdom,10,-16.6
C569985,23239,SET OF 4 KNICK KNACK TINS POPPIES,-6,10/6/2011 19:51,4.15,15365,United Kingdom,10,-24.9
C569985,23120,PACK OF 6 SMALL FRUIT STRAWS,-24,10/6/2011 19:51,0.42,15365,United Kingdom,10,-10.08
C569985,23119,PACK OF 6 LARGE FRUIT STRAWS ,-12,10/6/2011 19:51,0.62,15365,United Kingdom,10,-7.44
C569985,23074,EMBOSSED HEART TRINKET BOX,-6,10/6/2011 19:51,2.08,15365,United Kingdom,10,-12.48
C569985,23048,SET OF 10 LANTERNS FAIRY LIGHT STAR,-24,10/6/2011 19:51,4.15,15365,United Kingdom,10,-99.6
C569985,23041,PAPER LANTERN 9 POINT SNOW STAR,-24,10/6/2011 19:51,4.15,15365,United Kingdom,10,-99.6
C569985,22964,3 PIECE SPACEBOY COOKIE CUTTER SET,-6,10/6/2011 19:51,2.1,15365,United Kingdom,10,-12.6
C569985,22961,JAM MAKING SET PRINTED,-12,10/6/2011 19:51,1.45,15365,United Kingdom,10,-17.4
C569985,22960,JAM MAKING SET WITH JARS,-6,10/6/2011 19:51,4.25,15365,United Kingdom,10,-25.5
C569985,22730,ALARM CLOCK BAKELIKE IVORY,-4,10/6/2011 19:51,3.75,15365,United Kingdom,10,-15
C569985,22729,ALARM CLOCK BAKELIKE ORANGE,-4,10/6/2011 19:51,3.75,15365,United Kingdom,10,-15
C569985,22727,ALARM CLOCK BAKELIKE RED ,-4,10/6/2011 19:51,3.75,15365,United Kingdom,10,-15
C569985,22627,MINT KITCHEN SCALES,-2,10/6/2011 19:51,8.5,15365,United Kingdom,10,-17
C569985,22625,RED KITCHEN SCALES,-2,10/6/2011 19:51,8.5,15365,United Kingdom,10,-17
C569985,22624,IVORY KITCHEN SCALES,-2,10/6/2011 19:51,8.5,15365,United Kingdom,10,-17
C569985,22623,BOX OF VINTAGE JIGSAW BLOCKS ,-3,10/6/2011 19:51,5.95,15365,United Kingdom,10,-17.85
C569985,22622,BOX OF VINTAGE ALPHABET BLOCKS,-2,10/6/2011 19:51,11.95,15365,United Kingdom,10,-23.9
C569985,22617,BAKING SET SPACEBOY DESIGN,-3,10/6/2011 19:51,4.95,15365,United Kingdom,10,-14.85
C569985,22383,LUNCH BAG SUKI DESIGN ,-10,10/6/2011 19:51,1.65,15365,United Kingdom,10,-16.5
C569986,23015,CORDIAL GLASS JUG,-2,10/6/2011 19:52,8.25,16245,United Kingdom,10,-16.5
C569986,22824,3 TIER SWEETHEART GARDEN SHELF,-1,10/6/2011 19:52,35.95,16245,United Kingdom,10,-35.95
C569987,22439,6 ROCKET BALLOONS ,-40,10/6/2011 19:54,0.65,18194,United Kingdom,10,-26
C569987,22027,TEA PARTY BIRTHDAY CARD,-144,10/6/2011 19:54,0.36,18194,United Kingdom,10,-51.84
C569988,22766,PHOTO FRAME CORNICE,-1,10/6/2011 19:57,2.95,17231,United Kingdom,10,-2.95
C569989,21481,FAWN BLUE HOT WATER BOTTLE,-26,10/6/2011 20:08,2.55,16839,United Kingdom,10,-66.3
C569989,22111,SCOTTIE DOG HOT WATER BOTTLE,-17,10/6/2011 20:08,4.25,16839,United Kingdom,10,-72.25
C569989,23333,IVORY WICKER HEART MEDIUM,-12,10/6/2011 20:08,1.25,16839,United Kingdom,10,-15
C569989,23294,SET OF 6 SNACK LOAF BAKING CASES,-8,10/6/2011 20:08,0.83,16839,United Kingdom,10,-6.64
C569989,23293,SET OF 12 FAIRY CAKE BAKING CASES,-6,10/6/2011 20:08,0.83,16839,United Kingdom,10,-4.98
C569989,23296,SET OF 6 TEA TIME BAKING CASES,-8,10/6/2011 20:08,1.25,16839,United Kingdom,10,-10
C569989,23245,SET OF 3 REGENCY CAKE TINS,-4,10/6/2011 20:08,4.95,16839,United Kingdom,10,-19.8
C569989,23247,BISCUIT TIN 50'S CHRISTMAS,-36,10/6/2011 20:08,2.49,16839,United Kingdom,10,-89.64
C569989,23243,SET OF TEA COFFEE SUGAR TINS PANTRY,-18,10/6/2011 20:08,4.15,16839,United Kingdom,10,-74.7
C569989,22960,JAM MAKING SET WITH JARS,-10,10/6/2011 20:08,3.75,16839,United Kingdom,10,-37.5
C569989,23343,JUMBO BAG VINTAGE CHRISTMAS ,-7,10/6/2011 20:08,2.08,16839,United Kingdom,10,-14.56
C569989,23203,JUMBO BAG VINTAGE DOILY ,-20,10/6/2011 20:08,2.08,16839,United Kingdom,10,-41.6
C569989,85099B,JUMBO BAG RED RETROSPOT,-58,10/6/2011 20:08,1.79,16839,United Kingdom,10,-103.82
C569989,23298,SPOTTY BUNTING,-4,10/6/2011 20:08,4.95,16839,United Kingdom,10,-19.8
C569989,47566,PARTY BUNTING,-29,10/6/2011 20:08,4.15,16839,United Kingdom,10,-120.35
C569989,23321,SMALL WHITE HEART OF WICKER,-11,10/6/2011 20:08,1.65,16839,United Kingdom,10,-18.15
C569989,23313,VINTAGE CHRISTMAS BUNTING,-5,10/6/2011 20:08,4.95,16839,United Kingdom,10,-24.75
C569989,23306,SET OF 36 DOILIES PANTRY DESIGN,-6,10/6/2011 20:08,1.45,16839,United Kingdom,10,-8.7
C569989,22950,36 DOILIES VINTAGE CHRISTMAS,-12,10/6/2011 20:08,1.45,16839,United Kingdom,10,-17.4
C569989,22720,SET OF 3 CAKE TINS PANTRY DESIGN ,-25,10/6/2011 20:08,4.25,16839,United Kingdom,10,-106.25
C569989,22666,RECIPE BOX PANTRY YELLOW DESIGN,-23,10/6/2011 20:08,2.55,16839,United Kingdom,10,-58.65
C569989,22631,CIRCUS PARADE LUNCH BOX ,-7,10/6/2011 20:08,1.95,16839,United Kingdom,10,-13.65
C569989,22629,SPACEBOY LUNCH BOX ,-42,10/6/2011 20:08,1.65,16839,United Kingdom,10,-69.3
C569989,22384,LUNCH BAG PINK POLKADOT,-70,10/6/2011 20:08,1.45,16839,United Kingdom,10,-101.5
C569989,20725,LUNCH BAG RED RETROSPOT,-8,10/6/2011 20:08,1.65,16839,United Kingdom,10,-13.2
C569989,23236,STORAGE TIN VINTAGE DOILY ,-6,10/6/2011 20:08,2.89,16839,United Kingdom,10,-17.34
C569990,23243,SET OF TEA COFFEE SUGAR TINS PANTRY,-24,10/6/2011 20:11,4.15,15505,United Kingdom,10,-99.6
C569991,21673,WHITE SPOT BLUE CERAMIC DRAWER KNOB,-24,10/6/2011 20:15,1.45,14501,United Kingdom,10,-34.8
C569991,21672,WHITE SPOT RED CERAMIC DRAWER KNOB,-18,10/6/2011 20:15,1.45,14501,United Kingdom,10,-26.1
C569992,84944,SET OF 6 KASHMIR FOLKART BAUBLES,-48,10/6/2011 20:18,1.65,16133,United Kingdom,10,-79.2
C569993,23328,SET 6 SCHOOL MILK BOTTLES IN CRATE,-4,10/6/2011 20:28,3.75,17633,United Kingdom,10,-15
C569994,22964,3 PIECE SPACEBOY COOKIE CUTTER SET,-2,10/6/2011 20:33,2.1,15606,United Kingdom,10,-4.2
C569994,21479,WHITE SKULL HOT WATER BOTTLE ,-18,10/6/2011 20:33,3.39,15606,United Kingdom,10,-61.02
C569994,84031B,CHARLIE LOLA BLUE HOT WATER BOTTLE ,-21,10/6/2011 20:33,1.95,15606,United Kingdom,10,-40.95
C569994,84031A,CHARLIE+LOLA RED HOT WATER BOTTLE ,-20,10/6/2011 20:33,1.95,15606,United Kingdom,10,-39
C569994,22666,RECIPE BOX PANTRY YELLOW DESIGN,-11,10/6/2011 20:33,2.55,15606,United Kingdom,10,-28.05
C569994,22960,JAM MAKING SET WITH JARS,-10,10/6/2011 20:33,3.75,15606,United Kingdom,10,-37.5
C569994,23322,LARGE WHITE HEART OF WICKER,-3,10/6/2011 20:33,2.95,15606,United Kingdom,10,-8.85
C569994,23321,SMALL WHITE HEART OF WICKER,-11,10/6/2011 20:33,1.65,15606,United Kingdom,10,-18.15
C569994,22725,ALARM CLOCK BAKELIKE CHOCOLATE,-12,10/6/2011 20:33,3.75,15606,United Kingdom,10,-45
C569994,22728,ALARM CLOCK BAKELIKE PINK,-16,10/6/2011 20:33,3.75,15606,United Kingdom,10,-60
C569994,22727,ALARM CLOCK BAKELIKE RED ,-20,10/6/2011 20:33,3.75,15606,United Kingdom,10,-75
C569994,22729,ALARM CLOCK BAKELIKE ORANGE,-5,10/6/2011 20:33,3.75,15606,United Kingdom,10,-18.75
C569994,22730,ALARM CLOCK BAKELIKE IVORY,-11,10/6/2011 20:33,3.75,15606,United Kingdom,10,-41.25
C569995,23319,BOX OF 6 MINI 50'S CRACKERS,-48,10/6/2011 20:36,2.08,14557,United Kingdom,10,-99.84
C569995,23318,BOX OF 6 MINI VINTAGE CRACKERS,-24,10/6/2011 20:36,2.49,14557,United Kingdom,10,-59.76
C569995,23301,GARDENERS KNEELING PAD KEEP CALM ,-48,10/6/2011 20:36,1.45,14557,United Kingdom,10,-69.6
C569995,23267,SET OF 4 SANTA PLACE SETTINGS,-48,10/6/2011 20:36,1.25,14557,United Kingdom,10,-60
C569995,23154,SET OF 4 JAM JAR MAGNETS,-48,10/6/2011 20:36,2.08,14557,United Kingdom,10,-99.84
C569995,23120,PACK OF 6 SMALL FRUIT STRAWS,-48,10/6/2011 20:36,0.42,14557,United Kingdom,10,-20.16
C569995,23119,PACK OF 6 LARGE FRUIT STRAWS ,-24,10/6/2011 20:36,0.62,14557,United Kingdom,10,-14.88
C569995,22960,JAM MAKING SET WITH JARS,-12,10/6/2011 20:36,3.75,14557,United Kingdom,10,-45
C569995,22952,60 CAKE CASES VINTAGE CHRISTMAS,-24,10/6/2011 20:36,0.55,14557,United Kingdom,10,-13.2
C569995,22950,36 DOILIES VINTAGE CHRISTMAS,-24,10/6/2011 20:36,1.45,14557,United Kingdom,10,-34.8
C569995,22910,PAPER CHAIN KIT VINTAGE CHRISTMAS,-24,10/6/2011 20:36,2.95,14557,United Kingdom,10,-70.8
C569995,22909,SET OF 20 VINTAGE CHRISTMAS NAPKINS,-24,10/6/2011 20:36,0.85,14557,United Kingdom,10,-20.4
C569995,22737,RIBBON REEL CHRISTMAS PRESENT ,-30,10/6/2011 20:36,1.65,14557,United Kingdom,10,-49.5
C569995,22439,6 ROCKET BALLOONS ,-24,10/6/2011 20:36,0.65,14557,United Kingdom,10,-15.6
C569995,22436,12 COLOURED PARTY BALLOONS,-20,10/6/2011 20:36,0.65,14557,United Kingdom,10,-13
C569995,22086,PAPER CHAIN KIT 50'S CHRISTMAS ,-40,10/6/2011 20:36,2.55,14557,United Kingdom,10,-102
C569996,23268,SET OF 2 CERAMIC CHRISTMAS REINDEER,-12,10/6/2011 20:38,1.45,15322,United Kingdom,10,-17.4
C569996,23221,REINDEER HEART DECORATION SILVER,-12,10/6/2011 20:38,0.83,15322,United Kingdom,10,-9.96
C569996,23118,PARISIENNE JEWELLERY DRAWER ,-2,10/6/2011 20:38,7.5,15322,United Kingdom,10,-15
C569996,23112,PARISIENNE CURIO CABINET,-2,10/6/2011 20:38,7.5,15322,United Kingdom,10,-15
C569996,79191C,RETRO PLASTIC ELEPHANT TRAY,-12,10/6/2011 20:38,0.85,15322,United Kingdom,10,-10.2
C569996,79066K,RETRO MOD TRAY,-1,10/6/2011 20:38,0.85,15322,United Kingdom,10,-0.85
C569996,23221,REINDEER HEART DECORATION SILVER,-10,10/6/2011 20:38,0.83,15322,United Kingdom,10,-8.3
C570004,47594A,CAROUSEL DESIGN WASHBAG,-1,10/7/2011 9:21,1.95,13198,United Kingdom,10,-1.95
C570004,22371,AIRLINE BAG VINTAGE TOKYO 78,-1,10/7/2011 9:21,4.25,13198,United Kingdom,10,-4.25
C570005,22722,SET OF 6 SPICE TINS PANTRY DESIGN,-1,10/7/2011 9:22,3.95,14462,United Kingdom,10,-3.95
C570006,22784,LANTERN CREAM GAZEBO ,-1,10/7/2011 9:24,4.95,14217,United Kingdom,10,-4.95
C570012,23403,LETTER HOLDER HOME SWEET HOME,-1,10/7/2011 9:53,3.75,15344,United Kingdom,10,-3.75
C570012,22166,WALL MIRROR RECTANGLE DIAMANTE PINK,-2,10/7/2011 9:53,7.95,15344,United Kingdom,10,-15.9
C570012,22762,CUPBOARD 3 DRAWER MA CAMPAGNE,-2,10/7/2011 9:53,14.95,15344,United Kingdom,10,-29.9
C570012,23431,NATURAL HANGING QUILTED HEARTS ,-2,10/7/2011 9:53,0.83,15344,United Kingdom,10,-1.66
C570012,23401,RUSTIC MIRROR WITH LACE HEART,-1,10/7/2011 9:53,6.25,15344,United Kingdom,10,-6.25
C570066,23032,DRAWER KNOB CRACKLE GLAZE IVORY,-2,10/7/2011 11:09,1.65,16523,United Kingdom,10,-3.3
C570099,82583,HOT BATHS METAL SIGN,-1,10/7/2011 12:11,1.85,13798,United Kingdom,10,-1.85
C570099,35924,HANGING FAIRY CAKE DECORATION,-12,10/7/2011 12:11,1.69,13798,United Kingdom,10,-20.28
C570099,22064,PINK DOUGHNUT TRINKET POT ,-1,10/7/2011 12:11,1.45,13798,United Kingdom,10,-1.45
C570099,82583,HOT BATHS METAL SIGN,-4,10/7/2011 12:11,1.85,13798,United Kingdom,10,-7.4
C570099,20727,LUNCH BAG  BLACK SKULL.,-3,10/7/2011 12:11,1.65,13798,United Kingdom,10,-4.95
C570099,22377,BOTTLE BAG RETROSPOT ,-1,10/7/2011 12:11,1.65,13798,United Kingdom,10,-1.65
C570099,21936,RED RETROSPOT PICNIC BAG,-5,10/7/2011 12:11,1.65,13798,United Kingdom,10,-8.25
